name,document
Facebook_s discriminatory advertisement algorithm.pdf,"01-03-2021 Discriminated and discriminating without even knowing: how Facebook's ad delivery algorithm contributes to structural discrimination ""Senator, we run ads"", Mark Zuckerberg replies, unable to prevent a grin appearing on his face, after U.S. Senator Orrin Hatch asked him how Facebook can sustain a business model in which users do not pay for their service.1 Zuckerberg's witty - and truthful - reply might have put a smile on more faces than just Zuckerberg's, Facebook's advertisement mechanisms are everything but a joke. AlgorithmWatch found that Facebook's advertisement algorithm uses ""gross stereotypes to optimize ad delivery"", thus reinforcing structural discrimination.2 The aim and order of this paper is to, first, provide insight in the specifics of this case, second, to analyze the key stakeholders involved, third, explain the moral principles being broken, and fourthly, to address four possible solutions aiming to prevent structural discrimination by Facebook's advertisement algorithm and similar algorithms in the future. How Facebook optimizes its ad delivery in discriminatory ways Building on research on how Facebook's advertisers can exclude users by race when selecting their target groups, AlgorithmWatch wanted to go a step further and research the functioning of Facebook's ""second round of optimization"", which entails a second round of targeting, executed after advertisers submitted their own preferences.2 AlgorithmWatch advertised job offers on Facebook for machine learning developers, truck drivers, hairdressers, childcare workers, legal counsels, and nurses. All their ads were written in masculine form and contained a picture related to the job. The key part of their research design? None of the ads were targeted other than at their respective geographical areas. Where the researchers did not expect their ads to be shown completely fifty-fifty to men and women, they did expect to reach roughly the same audience. Nothing was less true. For example, in Germany, the ad"
Amazon's sexist AI hiring algorithm.pdf,"Midterm Essay: Amazon's sexist AI hiring algorithm   Until late 2018, Amazon had been using a state-of-the-art AI recruiting tool. It streamlined their hiring process in order to hire the best of the best whilst wasting as little time as possible in the candidate-searching process. Many major companies use such algorithms, especially for screenings. In October 2018 however, Reuters broke the news1 that the top-notch AI system actually showed clear bias against female applicants. This discrimination was particularly strong in positions of software development, as well as most technical positions.   I found Amazon's AI blunder to be a very interesting case study of an AI project where algorithms, as well as computational agents are responsible for discriminating against women.   How did this happen? A quick analysis  As soon as Amazon realized their AI discriminated against women, they scrapped the system and dealt with the problem internally, keeping PR communication at a minimum. However, we now know that the main reason for this misadventure is that Amazon's developers had trained their AI system based on models dating back over a 10-year period. Therefore, the recruiting tool had been trained to vet applications by observing the existing patterns of resumes which had been submitted to the company in the past decade. It comes without surprise that, in the 2010's, the tech industry was (and still is) dominated by men. Therefore, most applications used by the AI for training were from male applicants, a sad reflection of the vast male dominance over the industry. As such, Amazon's AI system taught itself that men were ""preferable"". It thus penalized resumes which included the word ""women"" (i.e., ""women's chess club captain) and downgraded applicants who had graduated from all-women's colleges.    Who was involved and who is"
Self-driving cars.docx,"systems' biases: the case of level 4 and 5 self-driving cars' recognition of pedestrians""Decades of fights for civil rights and equality have been unwritten in a few lines of code"", affirms EqualAI executive director Miriam Vogel[footnoteRef:1]. Thus, facial recognition technology in machine vision systems recognizes white men more easily than women and/or minorities' features. While this could be anecdotical in many decision-making related algorithmic applications, such irregularity can be decisive in life-threatening situations. Self-driving cars are the most striking example, as the potential for destruction is immense and since they are widely used. We are here considering level 4 and 5 self-driving cars, entirely based on automation and artificial intelligence (AI). Indeed, there is no human driver involved in their piloting, all are passengers while the AI is taking charge of the driving. Indeed, although only one pedestrian death has been recorded in the press since self-driving cars have been allowed on national roads[footnoteRef:2], depending entirely on automated systems and algorithms, their quick development led me to research on pedestrians' unequal vulnerability when faced to self-driving cars. Indeed, according to a research from Georgia Institute of Technology, ""a white person is 10% more likely to be correctly identified as a pedestrian than a black person""[footnoteRef:3]. [1:  Conference << Boundary Breakers: Women Driving The Future of Tech >>, Brooklyn, N.Y.]  [2:  Wakabayashi, D. << Self-Driving Uber Car Kills Pedestrian in Arizona, Where Robots Roam >>, The New York Times, March 2018.]  [3:  Wilson, B. Hoffman, J. and Morgenstern, J. Predictive Inequity in Object Detection, 2019.] Several stakeholders are involved in this discriminatory outcome - causing or enduring it. On the one hand, automakers are focused on ensuring that the car drives, and AI engineers on creating the most precise decision process to make the driving accurate"
Amazon_hiring tool.pdf,"dominant presence as the largest online retailer has its own challenges in terms of hiring large number of employees. Automation being one of the key tools to the company's growth, a similar approach was to be taken with respect to hiring. Amazon in 2014 set up a team, based in Edinburgh, to develop a hiring tool powered by artificial intelligence. The objective of the tool was to simplify the process of hiring and ensure that the ""best"" candidate for the job was chosen.  The tool was to scrape the web for candidates and give a rating to individuals in the same five-star format that amazon products are subjected to. This would simplify the process so as to review the most apt candidates for subsequent rounds. It was soon discovered that the tool was discriminatory towards women in particular. The algorithm began to penalize candidates based on keywords such as ""women"" from ""women's chess club captain"". Although the engineers attempted to rectify such an issue, the algorithm was found to circumvent these and reform discriminatory biases. Candidates of two all-girls schools were down voted even though they had never mentioned their schools. The tool thus showed female candidates in an unfavorable light, preferring male oriented resumes.   Amazon soon shut down its division in 2015 and stated that no hiring process was carried out using the tool. The problems were beyond gender bias as they noticed that unqualified candidates were recommended for the job. However, a more elementary version of the tool was used to handle simpler tasks later on (such as removing duplicate candidates). Amazon is hoping to approach the tool once again as of 2018, this time focusing on diversity.  Key takeaways The tool was not generic, the team created 500 models so as to suit"
biased_liberal_media.pdf,"Conservatives: The Right (in) Numbers The January 6th US Capitol insurrection attempt by far-right militias, Donald Trump supporters and Skyrim cos-players, as well as the subsequent Trump's twitter ban have revitalized inquiries into the role that social media platforms play in democratic processes. Until now regarded as refuge and breeding ground for populist right-wing politics, big tech corporations like Google, Facebook and Twitter have been added to the ""biased liberal media"" hit-list following republican allegations of unfair content curation. With algorithms and machine learning technology being the primary tools of mass social media management, they too are at the heart of the rather bipartisan concern over the covertly-totalitarian power that big tech companies exert over agenda-building. In the past few years Facebook, Instagram and Google's algorithms have been shown to produce racist, sexist and classist results, spawning a wealth of research on ""algorithmic fairness"", but continued lack of transparency, access and understanding about the technologies at play have made it an easy target for anxiety-farming politics. More recently republicans have launched campaigns against perceived unfairness and preferential treatment for their political opponents, with Senators Ted Cruz and Josh Hawley urging the Federal Trade Commission to investigate content curation that allegedly censors right-wing ideas. Are their frustrations warranted, or is it another falsehood instrumentalized for political gains? What role do algorithms play in partisan politics? 90% of US republicans believe it is likely that social media sites censor political viewpoints and are way more likely than democrats to believe that their political opponents are favored instead (Pew, 2020). Some examples of alleged censorship include Twitter's decision to deploy automated labels that notify users if a post didn't pass a fact-check or violated terms of use, as well as the ominous sounding ""shadow-ban"" feature that supposedly silences conservative spokespersons. Facebook too has"
AI biases in the criminal justice system.docx,"Criminal Justice SystemI-Main actors involved: Who is denouncing whom?Risk assessments scores are increasingly common in courtrooms across the US. These modern risk tools were originally designed to provide judges with insight into the types of treatment that an individual might need, from drug treatment to mental health counseling. But today these algorithms are used to help judges predict the level of danger that a defendant could represent if he were to be set free. Therefore, these algorithms influence judge's decisions at every stage of the criminal justice system by deciding who can be set free before a trial, or by assigning sentences or parole. The most common algorithm that is used today to rate defendants' degree of violence and to define their sentence is the Correctional Offender Management Profiling for Alternative Sanctions (COMPAS) algorithm. The Justice Department's National Institute of Corrections has been encouraging in the last years the use of such automated assessments at every stage of the criminal justice process. A reform bill mandating the use of such assessments in federal prisons is also pending in the US Congress. However, in 2014, then U.S. Attorney General Eric Holder had warned that risk scores generated by AI algorithms might be injecting bias into the courts, by exacerbating unjustified and unfair disparities that are already very widespread in the US criminal justice system, such as the color of the skin or the wealth of the individual. Yet the sentencing commission did not launch any study that could assess the validity and the accuracy of these of risk scoresAttention to the real efficiency of these algorithms only arose when sentences made by judges in different American states which authorized the use of risk assessments to dictate a sentence, started to be made public. There is an exhaustive list of cases. For"
Teenage_Pregnancy.pdf,"de Intervencion Social: sexism and hidden interests Teenage pregnancy is an issue treated differently by the different communities around the world. The               province of Salta, in Argentina, decided to turn to AI to generate effective policy to try to change this                   reality. In partnership with Microsoft, the province decided to work on a public-private partnership in               which the government would provide the datasets on the target population of the project and the                company would provide the software to be used in the operation. The datasets provided by government                on the target population gathered data of girls and young women between 10 and 19 years old, including                  age, country of origin, ethnicity, educational level of the household head, neighbourhood, mental and              physical disabilities, number of people in the household, and the availability of running hot water within                the household1. The goal of this project was to identify the likelihood of this population to undergo                 teenage pregnancy before it occurs, and provide directed action to"
Optum's Health Care Algorithm.pdf,"In late 2019, numerous media outlets reported that artificial intelligence software widely used by American hospitals had led to racial discrimination in the provision of health care. The findings came from a study, published in Nature, which revealed that black patients were less likely than equally sick white patients to be allocated additional care resources. The culprit identified was an algorithm, sold by health services company Optum, and used in managing the care of about 200 million Americans.1 The algorithm consistently underestimated the health care needs of black patients; if the racial bias had been corrected, the percentage of Black patients receiving extra medical attention would have gone up from 17.7% to 46.5%.2 Bias in the data The problem with Optum's algorithm was that it used cost as a metric to establish need for treatment. On face value, this makes sense: the higher a patient's historical cost of care, the more likely it is that this patient is very sick and needs specialised attention. And a cursory check of the data itself shows nothing unusual: average costs for black patients are about the same as average costs for white patients. The problem then? Black individuals are actually substantially sicker, on average, than white individuals. 3Clearly, the cost metric doesn't accurately represent black patients' level of sickness. Underlying inequities So why do black patients spend less on treatment? Because of unequal access to health-care. Higher rates of poverty among black households means that black patients use medical services less than their white counterparts.4 There is also a history, in U.S.medicine, of discrimination and racist practices towards black individuals. Black patients have often been used for medical experimentation without their explicit consent,like in the infamous Tuskegee study. A substantial amount of research in psychologyhas also documented differences in the perception of black patients by physicians, interms of intelligence, or or pain tolerance, for instance.5 As a result, Black patientshave"
